"Align Pant II 25""",https://shop.lululemon.com/p/women-pants/Align-Pant-2/_/prod2020012?color=35552,2.9 out of 5,194,Used to be my favorite,"These pants used to be my absolute favorite. While they are insanely comfortable, I am now on my third pair because they are constantly falling a part. My current pair are only about 2 months old and are pilling everywhere. They have gotten so bad that I can no longer where them. Very disappointed after constantly spending almost $100 for these pants.",2 out of 5,BRIJUR,,,,,,,,2016-05-29,1,1,"{'LL_response_content': 'Hey BriJur,\nThanks for taking the time to share with us about your Align Pant II. I’m sorry to hear of the pilling you’re experiencing with them. We stand behind our quality, and we’d love to work with you towards a solve. Please give us a ring at 1.877.263.9300 so we can find a fix. Chat with you shortly. ', 'LL_response_date': 'May 30, 2016'}"
"Align Pant II 25""",https://shop.lululemon.com/p/women-pants/Align-Pant-2/_/prod2020012?color=35552,2.9 out of 5,194,great customer service experience with this pant,"I bought the original align pant back in January. The thinness of the material is both a blessing and a curse. These pants are ridiculously comfortable and easy to move in but I did notice the material pilling pretty quickly in the thigh area. I don't mind it so much because I bought them to use as leggings I wear under dresses and skirts in colder weather.
However, I saw that one of the seams near the ankle was coming undone and recently noticed it getting worse. After reading the other reviews about this problem I talked to a rep online. They were more than happy to organize a replacement. I ended up just taking them to the store near me, where one of the employees told me to grab a new pair off the shelf (this time an align pant II) and exchanged it for me. I hope this pair will do better than my first but certainly appreciate that I have always been able to resolve issues that occasionally come up with my lulu items without any difficulty.",4 out of 5,SUSANNAZ,PITTSBURGH,SWEATY GENERALIST,25-34,CURVY,,comfortable,thin material,2016-05-29,2,0,{}
"Align Pant II 25""",https://shop.lululemon.com/p/women-pants/Align-Pant-2/_/prod2020012?color=35552,2.9 out of 5,194,Love Love Love!!!,"These pants are an amazing staple for any yogi, runner, or chic errand runner. They fit you like a glove and never lose their shape!",5 out of 5,MERCEDEZ,"SAN FRANCISCO, CA, USA",,18-24,CURVY,,,,2016-05-28,1,1,{}
"Align Pant II 25""",https://shop.lululemon.com/p/women-pants/Align-Pant-2/_/prod2020012?color=35552,2.9 out of 5,194,"Love, love, love!","Fantastic pair of pants! I've worn them at least once a week for a month now and have washed them 3 times. They have kept their shape and have not pilled at all. Very breathable and airy I've worn them to heated barre and sculpt classes and have stayed cool and comfortable. I'm 5'6"" and 120lbs and a size 6 fit great.",5 out of 5,BARREBELLE21,"MINNEAPOLIS, MN, USA",SWEATY GENERALIST,35-44,LEAN,,kept me cool,waist is a little higher than i'd want,2016-05-27,1,0,{}
"Align Pant II 25""",https://shop.lululemon.com/p/women-pants/Align-Pant-2/_/prod2020012?color=35552,2.9 out of 5,194,Wonderful...until you wear/wash them twice.,"I was so excited about this new pant and Lululemon's new ""naked feel"". I bought these and they became my new favorite pant!! I have a lot of Lululemon, and have occasionally noted more pilling than usual, but these pants are basically falling apart from so much pilling. I thought maybe it was just a bad pair, so I bought another pair-same size and color-and the same thing happened. Now I have two pairs that are both very pilling very bad and seem to be falling apart. There is so much pilling that the fabric is thinning and I am worried they may even rip.",2 out of 5,ECHICAGO,,,,,,,,2016-05-27,1,0,"{'LL_response_content': ""Hi there EChicago,\nThank you for reaching out and taking the time to write your review. I'm sorry to hear of the pilling that you're experiencing on your pants. I'd suggest reaching out to our GEC to chat further about this - 1.877.263.9300."", 'LL_response_date': 'May 27, 2016'}"
"Align Pant II 25""",https://shop.lululemon.com/p/women-pants/Align-Pant-2/_/prod2020012?color=35552,2.9 out of 5,194,The most comfortable work out pants,"I have never had more comfortable work out pants. The fit is extremely flattering. I feel well protected wearing them, yet they feel like second skin. This is my favorite ""go to"" pant.",5 out of 5,CHERNOMOR,"FARGO, ND, USA",SWEATY GENERALIST,45-54,ATHLETIC,,fit and quality,,2016-05-26,0,1,{}
"Align Pant II 25""",https://shop.lululemon.com/p/women-pants/Align-Pant-2/_/prod2020012?color=35552,2.9 out of 5,194,Comfortable but Poor Quality,"After recommendations from multiple friends, I decided to take the plunge and buy myself some of the Align leggings. They are hands down the most comfortable pair of pants I've ever owned. The Naked fabric truly does make it feel as if these leggings are you second skin. But I've worn them twice, haven't even worked out in them yet, and washed them once according to the care instructions and the waistband threads are coming out and the sides of the pant are pilling so badly it's noticeable from a distance. For almost $100 I expected both a fabulous fit and excellent wear, and while the Align pant is incredibly comfy, it's not worth that much money for pants that pill so soon.",2 out of 5,S1H8WNA,,,,,,fit,fabric,2016-05-25,2,0,"{'LL_response_content': ""Hi s1h8wna,\nI appreciate you taking the time to let us know this happened to your pant. We stand behind the quality of our gear, and if our product doesn't perform for you, we’d love to help you out. While pilling does not impact the functionality of your pants, I know it is not the look you want them to have. We'd love to make this right, and create a resolution for you. We have sent you an email to chat further."", 'LL_response_date': 'May 26, 2016'}"
"Align Pant II 25""",https://shop.lululemon.com/p/women-pants/Align-Pant-2/_/prod2020012?color=35552,2.9 out of 5,194,Amazing...until you wash them,"So I saw these pants all over the fitness side of instagram and knew I had to try them on. Went to the store, put them on, and instantly fell in love! So in love that I bought them without thinking and then later had to return them after I got my wits about me and realized I couldn't actually afford them at that time haha. After saving up I bought them in a size 4. My measurements are 32-24-38 inches for reference and I'm 5'2, and at first I went by the size chart and tried a size 8. Way too big in the waist, so I sized down to a size 6 which was better but still a bit big and made them sag in the crotch. The size 4 is perfect! Fits my waist snug and is super comfortable on my legs too. I would recommend sizing down if you aren't sure what size to get.
I wear them for lifting, even though I know they aren't for that. Despite using them for the gym (not cardio) they stayed in perfect condition. I put off washing them because I knew they had terrible reviews online about pilling and seams falling apart.
I washed them today in a lingerie bag on delicate by itself in cold water, hung it up to dry, and lo and behold, the seems are fraying pretty badly. It's mostly on one side, and there is also a couple pills there too. Very concerning after dropping more than $100 and this is only after the first wash.
Another thing is, they show sweat despite the ""sweat wicking"". I usually workout in nike dri fit running pants, and they never ever show sweat. Ever. So I was shocked and embarrassed when I found out on leg day that these show sweat. Before I bought them, I talked to a lululemon online chat person and asked them specifically if they showed sweat because I didn't want that, and they said no. They said only if you are sweating excessively will it show. I was not sweating excessively at all when it showed. I called my local store about it and the manager was shocked that someone would tell me that they wouldn't show sweat, and had a bit of an attitude saying that OF COURSE they would show sweat since you're wearing spandex pants (can you hear the implied ""duh""?). So keep that in mind if you want these and don't want sweat to show. I have found that wearing a full underwear and not a thong helps though.
Bottom line: There are no other pants like these that I've tried on, and trust me I've tried soo many looking for any other highwaisted workout pant and none are as comfortable as these. If you have a lot of money where $100 isn't a big deal to you, then go for it and get these. They feel amazing on. But if you're like me and think $100 is a lot of money to spend on leggings, don't buy these. I""m so sad they aren't holding up. At least lululemon does repairs, right? (although now it's clear why).",2 out of 5,SUNDRIEDSTARS,"SAN JOSE, CA, USA",SWEATY GENERALIST,18-24,ATHLETIC,,super soft,quality,2016-05-25,1,1,"{'LL_response_content': ""Hey Sundriedstars,\nThanks for checking in and providing your detailed feedback. We stand behind the quality of our gear, so we'd like to work with you to make this right. I've gone ahead and sent you a follow up email so we can make things right - chat with you soon."", 'LL_response_date': 'May 25, 2016'}"
"Align Pant II 25""",https://shop.lululemon.com/p/women-pants/Align-Pant-2/_/prod2020012?color=35552,2.9 out of 5,194,Hole near the seam,"Im really really hoping that this is just like a one time thing, a defect in just this pair because other than this dang hole that has appeared, they are perfect. so soft and magical. i've had them for less than a month and followed all washing instructions and when putting them on today i found a hole developing on the seam on the inside of my knee :( no problems with pilling though. i really really want more of these leggings but i cant rationalize spending close to $100 on leggings that develop a hole in less than a month.",4 out of 5,MEOWZOEMEOW,"SANTA CRUZ, CA, USA",SWEATY GENERALIST,18-24,SOLID,,soft fabric,poor quality,2016-05-21,0,0,"{'LL_response_content': ""Hey there meowzoemeow,\nI'm so sorry to see and hear about the hole you're experiencing on the seam of your pants. I definitely want to help turn this situation around. Look out for an email that will identify how to proceed."", 'LL_response_date': 'May 21, 2016'}"
"Align Pant II 25""",https://shop.lululemon.com/p/women-pants/Align-Pant-2/_/prod2020012?color=35552,2.9 out of 5,194,Not disappointed!!!,"I waited a few weeks to do this review so I could wear the pants multiple times and wash them several times. These don't disappoint! The fabric feels incredible. I've been doing yoga for two years and always struggle with the waistband in pants, having to fix it, etc. Not on these! No adjustment throughout the practice at all! This was huge for me! And please wash your yoga pants in lingerie bags (these or any other expensive pair really); people complaining about pilling are probably putting these pants in the wash with other rough and heavy fabric.
I'm 5 foot 8, 150 lbs and got a size 8. They fit great.",5 out of 5,YOGINVIRGINIA,"VIRGINIA, USA",YOGI,25-34,CURVY,,the feeling of the fabric,,2016-05-21,3,1,{}
"Align Pant II 25""",https://shop.lululemon.com/p/women-pants/Align-Pant-2/_/prod2020012?color=35552,2.9 out of 5,194,Comfortable but seam coming out,Was pleasantly surprised when I put these on. They're so much more comfortable compared to an old pair of Lululemon leggings I had. I wore them today and they kept me warm in the chilly SF weather. The sales girl gave me a tip not to dry it with towels or it'll pill. So far no pilling. The ONLY thing that I have to complain about is I noticed the seam is coming apart on the bottom and I've only washed it once :(,4 out of 5,LULULEMONFANGIRL,"SAN FRANCISCO, CA, USA",,25-34,,,comfortable,seams coming apart,2016-05-21,0,0,"{'LL_response_content': ""Hi there lululemonfangirl,\nIt's great that you're loving the comfort of your pants, but I'm sorry to hear of your experience with the seams are coming apart. I'd love to help turn this around, so watch for an email that describes how to move forwards."", 'LL_response_date': 'May 21, 2016'}"
"Align Pant II 25""",https://shop.lululemon.com/p/women-pants/Align-Pant-2/_/prod2020012?color=35552,2.9 out of 5,194,"Super comfy, but delicate fabric","I love how comfortable these pants are, I can live in them! They are very very comfy and high-rise for a secure fit. I give them 5 stars for comfort, but unfortunately my pair starting pilling after the first wash and a thread came loose. I am afraid to cut the thread off and them ripping (they were $98!). I would recommend carefully inspecting the pair you intent to buy in the store.",3 out of 5,LIZCOR,,,,,,comfort,delicacy of fabric,2016-05-20,0,0,"{'LL_response_content': ""Hi there LizCor,\nI'm sorry to hear of the pilling and loose threads that you're experiencing with your pants. I'd definitely recommend reaching out to our GEC, where an educator will be able to chat to you further - 1.877.263.9300."", 'LL_response_date': 'May 20, 2016'}"
"Align Pant II 25""",https://shop.lululemon.com/p/women-pants/Align-Pant-2/_/prod2020012?color=35552,2.9 out of 5,194,Superb. No pilling.,"I have several pair and I wear them all at least once per week as a barre fitness instructor and gym enthusiast. I wear a 6 in Wunder Unders and sized down to a 4 in this pant for a snug fit because the fabric is stretchy. The fabric is, as everyone will shout from a mountain top: super soft and feel oh so good. The comfort is unsurpassed - from the waist band to the ankle - just buttery soft gentle compression. My favorite aspect of these pants is that they stay put. I NEVER have to adjust them. I love my Wunder Unders but they require one or two pulls and tugs over the course of wear and I had to stop wearing anything Luxtreme because they just slide right off me. I'm waiting...and hoping that Lulu will release these in a full length 31"" inseam a la Wunder Under, as I am a tall girl. As far as the pilling issue I see in ever other review....idk....I just don't have it. I put these things to the test in both barre and at the gym and so far they look good as new. I wash all of my Lulu in Woollite, cold water and hang dry. I do not use fabric softeners or wash my Lulu with any other type of fabric, not a sock, not a cotton shirt. Maybe this is part of my success? Also, I do not lounge in these - around the house or otherwise. These are royalty and only go to the studio or gym. Worth the purchase. They're good enough to eat. 5'10 158# lean build.",5 out of 5,LIVEFIT40,"PACIFIC NW, US",SWEATY GENERALIST,35-44,LEAN,,everything,too few colors : ),2016-05-19,3,0,{}
"Align Pant II 25""",https://shop.lululemon.com/p/women-pants/Align-Pant-2/_/prod2020012?color=35552,2.9 out of 5,194,Super soft and comfy but----,"I got one pair of these pants in a store and I loved them so much because they were super soft and comfy, making me really want to get a second pair. However they started pilling and falling apart after two wears and my careful wash. Now the pants look like a little bit unworthy bcoz they are not cheap.",2 out of 5,NIUBERBER,"CALIFORNIA, USA",YOGI,25-34,ATHLETIC,,,,2016-05-19,0,0,"{'LL_response_content': ""Hey Niuberber,\nThanks for your review on the Align Pant II. We stand behind the quality of our gear and would like to work towards a solve for the pilling you're experiencing with your Align Pant II. Keep your eyes peeled for an email headed your way so we can follow up and chat further.\nTalk soon!"", 'LL_response_date': 'May 19, 2016'}"
"Align Pant II 25""",https://shop.lululemon.com/p/women-pants/Align-Pant-2/_/prod2020012?color=35552,2.9 out of 5,194,"Super Soft, but my least favorite purchase from Lulu","I bought one pair of these pants online and when I got them in the mail and finally tried them on I loved them so much. However, I wore them TWO times and they already started pilling. I have over 10 pairs of Lululemon's and have never had this issue with any other garments. Now I have 2 pairs of them and am so scared to wear them because I worry the pilling is making the pants so thin that they will rip and not be wearable anymore. I really wish I had opted for some of my other favorites like the wunder unders or the inspire tights. I am not sure how to remedy this situation now that I just wasted 200 dollars on pants that should have been 20 dollars.",2 out of 5,LEEMILYLEE,"LONG BEACH, CA, USA",YOGI,25-34,ATHLETIC,,,,2016-05-18,0,0,"{'LL_response_content': ""Hey LeEmilyLee,\nThanks for your review on the Align Pant II. I'm sorry to hear you're experiencing pilling with them and would like to work towards a fix with you. An email is headed your way so we can chat further and help out.\nSpeak soon!"", 'LL_response_date': 'May 19, 2016'}"
"Align Pant II 25""",https://shop.lululemon.com/p/women-pants/Align-Pant-2/_/prod2020012?color=35552,2.9 out of 5,194,Holy Schnikes! BEST PANTS EVER!,"I first bought this pant in the crop version in black. When I put these pants on I forgot my name for a minute...Yeah, they are THAT good! I immediately went to the computer and ordered this pant (the longer version) because clearly I need the entire world to be made of this material and I need this pant in every way it comes. I have now worn and gentle cycle washed/air dried both pairs of these pants 5 or 6 times, and they continue to be perfect. I have not experienced any pilling issues like some of the other reviewers have, and I hope that this doesn't happen to me. This material is life-changing. It is light and so soft - truly naked sensation - but the fabric is somehow thick enough to smooth, define and make you look flawless. I wore these pants as leggings to work the other day and made a co-worker pet me...I think she immediately went online and bought a pair. Do the lower half of your body a favor and get these pants. I'm telling you....HOLEY SCHNIKES!",5 out of 5,CFLAKEGRL,"TAMPA, FL, USA",SWEATY GENERALIST,35-44,CURVY,,fabric,these pants are perfection! nothing to hate!,2016-05-18,1,0,{}
"Align Pant II 25""",https://shop.lululemon.com/p/women-pants/Align-Pant-2/_/prod2020012?color=35552,2.9 out of 5,194,Super Comfy,"I am in love with this pants. I own 8 of them including crops. The pants are really soft, and they feel so good against my skin. I've done yoga, hiking, and running in these and so far they seem to hold up well. I washed them once so far, and thank goodness no pilling. Will update with a few more washes. I'd like to see more COLORS and PRINTS in these please.",5 out of 5,MILLACHARLIE,"SOUTHERN CALIFORNIA, CA, USA",YOGI,35-44,PETITE,,,limited colors and prints,2016-05-18,0,0,{}
"Align Pant II 25""",https://shop.lululemon.com/p/women-pants/Align-Pant-2/_/prod2020012?color=35552,2.9 out of 5,194,Best pants I've ever put on my body,"These are the most comfortable, amazing pants I've ever worn. I want to wear them all day, every single day. They are perfect for yoga - they move with your body and they're so soft. PLEASE make them in mid-rise! I'm too short for high-rise! I'm 5'1"" and they come up to my chest and roll down. I still love them regardless, but I'd love them even more if they were mid-rise.",5 out of 5,MICHELLES,"BUFFALO, NY",YOGI,25-34,PETITE,,,,2016-05-18,1,0,{}
"Align Pant II 25""",https://shop.lululemon.com/p/women-pants/Align-Pant-2/_/prod2020012?color=35552,2.9 out of 5,194,Great but not so great,"These were the first pair of Lululemon leggings I bought. After I had worn them for less than 24 hours, I ordered my second pair. I now own 3 in this style. This black pair however are the worst quality out of all 3. The pilling is insane. I don't have a crazy thigh gap but my thighs don't create sparks when I walk either. The pilling is so bad in some areas that I'm afraid the fabric is going to wear thin and start getting holes within the next few wears. I've started wearing them inside out every other time I wear them just to alternate which side wears down. The other two pairs I have are showing minimal pilling, but they are still pilling. I don't know if it's just a side effect of the fabric being so thin or what. I love these leggings and would wear them every day if I didn't have to pay $98 every 2 months to replace them. I'd expect this from a $20 pair of Target leggings, which I'll have to go back to when I'm forced to trash these.",2 out of 5,RUNITSKAT,"CALIFORNIA, USA",YOGI,25-34,PETITE,,,,2016-05-17,2,0,"{'LL_response_content': ""Hi runitskat,\nWe're sorry to hear you're experiencing pilling with your Align Pant II. We would love to ask you a few questions to better understand why you may be experiencing this. We have sent you an email to have a further chat."", 'LL_response_date': 'May 17, 2016'}"
"Align Pant II 25""",https://shop.lululemon.com/p/women-pants/Align-Pant-2/_/prod2020012?color=35552,2.9 out of 5,194,"Perfect, other than the pilling","I have tried so hard to carefully wash all of my Lulus, including these. After about 10 washes, the pilling is awful. I wish I had read the reviews because it seems to be a common problem. Other than that, SO comfortable!",3 out of 5,KAL2016,,,,,,,,2016-05-16,1,0,"{'LL_response_content': ""Hey kal2016,\nWe're sorry to hear you're experiencing pilling with your Align Pant II. We stand behind the quality of our product, and we want to ensure that you're in gear that is performing well for you. Please give our GEC a call- 1.877.263.9300 as they'll be able make some recommendations about how to proceed."", 'LL_response_date': 'May 17, 2016'}"
"Align Pant II 25""",https://shop.lululemon.com/p/women-pants/Align-Pant-2/_/prod2020012?color=35552,2.9 out of 5,194,So soft,"These are incredibly soft, luxurious, and make any movement feel so wonderful. Hands down the softest yoga pants I have ever worn. I couldn't give 5 stars for 1 reason: the piling! After the very first wash there was some piling between the thighs. I put this in a lingerie bag, washed with only other delicates on cold with regular detergent and hung dry. I don't know what else to do care wise. When I pay this much for something I expect the fabric to hold up to normal use. I hate the price tag when the fabric seems to wear out so quickly. I had very high hopes because again, they are so comfortable. Be wary of purchasing these unless you have the time to hand wash !",4 out of 5,SKITTEN,"KANSAS CITY, MO",SWEATY GENERALIST,25-34,ATHLETIC,,soft feel,quick wear and piling,2016-05-16,0,0,"{'LL_response_content': ""Hey skitten,\nThanks for touching base. We're bummed to hear you're experiencing pilling with your Align Pant II, and definitely want to make things right because we stand behind the quality of our gear. I've gone ahead and sent you a follow up email so we can do just that."", 'LL_response_date': 'May 16, 2016'}"
"Align Pant II 25""",https://shop.lululemon.com/p/women-pants/Align-Pant-2/_/prod2020012?color=35552,2.9 out of 5,194,"Love them, but...","After reading a ton of positive reviews from buyers, I decided to invest in these tights. I absolutely LOVE them and they feel amazing. I wear them often; however, after about 2 months of (delicate) use and only 1 wash (by hand), I noticed pilling on the inside of my right knee. I have heard great things about Lulu's customer service so I took them in and explained my situation. The sales associate was very understanding and told me that they've had problems with this specific tight and pilling. I went and grabbed another pair and exchanged them without any problems. There was only one pair left in my size so I scanned the seams prior to walking back up front and noticed more pilling on the ankle. I asked another associate if this would get worse and she said they shouldn't, but to keep a close eye and come back in if it happens to those as well. I may or may not be returning with the same issue, but I am happy with how they handled the situation.",4 out of 5,KCFITNESSFAIRY,,,,,,,pilling,2016-05-16,1,0,"{'LL_response_content': 'Hey KCFitnessFairy,\nThanks for reaching out to us about your Align Pant II. We stand behind the quality of our gear, and we’d like to work with you towards a fix. Please give us a ring at 1.877.263.9300 so we can resolve this issue together. Chat with you soon. \n ', 'LL_response_date': 'May 16, 2016'}"
"Align Pant II 25""",https://shop.lululemon.com/p/women-pants/Align-Pant-2/_/prod2020012?color=35552,2.9 out of 5,194,"Poor quality, pilling, lulu refused refund",These are beautiful and super comfortable. I want to love them. But they started pilling after three wears. Haven't even worked out in them yet. I asked for a refund and was told I can only return for a gift card. I have had the pants for a week. And they don't offer simultaneous exchanges. I have to return these first. And then wait for my gift card to arrive in the mail. Because it's 1998. Disappointed. :(,1 out of 5,RUNRUNFORFUN,,RUNNER,25-34,SLIM,,,,2016-05-13,3,0,"{'LL_response_content': ""Hi there RunRunForFun,\nI'm sorry to hear that the Align Pant is not working out the way you need it to, and that the return process offered is not something that you are happy with. Know that we do stand behind the quality of our gear, and always want our guests to feel happy and valued. I will be reaching out shortly via email to chat through some options with you.\n~Kate, Digital Engagement"", 'LL_response_date': 'May 13, 2016'}"
