"Align Pant II 25""",https://shop.lululemon.com/p/women-pants/Align-Pant-2/_/prod2020012?color=35552,2.9 out of 5,187,the align pant,"I have had these since last fall/winter andI just know decided to write a review, because I wanted to warn people before buying. Ever since I got them and washed them the first few times there has been major peeling and they look like they have been worn for a few years. I love how soft and comfortable they are though, i have the very first version, so hopefully they have improved with the II. Just know hey peeling ALOT, look old, but fell amazing.",2 out of 5,OUTDOORS,"NASHVILLE, TN, USA",SWEATY GENERALIST,UNDER 18,ATHLETIC,,soft,peeling,2016-09-29,1,0,"{'LL_response_content': ""Hey outdoors,\nYikes. We're sorry to hear that you've experience pilling after a few wash and wears. An email is headed your way so we can follow up with some return solutions for the pilling you've experienced with your Align Pant.\nSpeak with you soon."", 'LL_response_date': 'September 30, 2016'}"
"Align Pant II 25""",https://shop.lululemon.com/p/women-pants/Align-Pant-2/_/prod2020012?color=35552,2.9 out of 5,187,Waste of money,These pants began pilling almost immediately. Not only in the crotch area but also along the upper thigh for no apparent reason. They also seem to lose their durability because after a few wears they are no longer as tight and compressing as they were at the start. Very disappointing because the material was originally very soft and comfortable.,2 out of 5,PROY,"SEATTLE, WA, USA",SWEATY GENERALIST,18-24,PETITE,,,,2016-09-29,2,0,"{'LL_response_content': ""Hey PRoy,\nWe hear your disappointment with your buttery-soft Align Pant II and the pilling and stretching issues you've encountered. An email is headed your way so we can follow up with some return solutions.\nChat with you soon."", 'LL_response_date': 'September 30, 2016'}"
"Align Pant II 25""",https://shop.lululemon.com/p/women-pants/Align-Pant-2/_/prod2020012?color=35552,2.9 out of 5,186,Comfy but not worth it,"I had been saving up to buy a pair of lulus for the longest time. I finally got the nerve to throw down the money for a pair. I tried on a lot of pairs and fell in love with the align 2. They are unbelievably comfortable I will give you that but it is not worth the price for they started pilling with in the first two weeks!! Its only gotten worse since, I feel like the quality is diminishing quickly. I am honestly afraid to wear them because I dont want them to get worse. It really sucks that I have had such a bad experience on my first pair, I scared to even buy another one :(",2 out of 5,SPRINKLEEZ,,,,,,,,2016-10-15,0,0,"{'LL_response_content': ""Hi there sprinkleez,\nI hate to hear that you're afraid to wear your gear and I'm sorry that you're experiencing pilling on your pants. I'd highly recommend reaching out to our GEC to turn this situation around - 1.877.263.9300."", 'LL_response_date': 'October 18, 2016'}"
"Align Pant II 25""",https://shop.lululemon.com/p/women-pants/Align-Pant-2/_/prod2020012?color=35552,2.9 out of 5,186,fabric needs improvement,"I really love the fit and feel of these pants. They are very flattering, super soft and move with your body. I loved these so much that I bought a second pair, within a couple weeks. It's been a couple of months and I alternate wearing the two pairs but they are pilling horribly, especially between thighs. These would be the perfect pants if they did not pill so this is a huge disappointment considering the price.",3 out of 5,SWELLS,,SWEATY GENERALIST,25-34,ATHLETIC,,,,2016-10-14,0,0,{}
"Align Pant II 25""",https://shop.lululemon.com/p/women-pants/Align-Pant-2/_/prod2020012?color=35552,2.9 out of 5,186,Disappointed,"I got these pants and the thread at the bottom and in the crotch started to come undone when I had followed the wash instructions and only had them for 2 months. When I took them to the store, the employee simply told me ""that just happens with those pants. I can swap them for a new pair but the thread will come out of those too."" Are you kidding me? These are $100 pants that you continue to stock and recommend to people. Extremely disappointed not only in the quality, but in the response I got from the employee.",1 out of 5,BODYPUMPER87,"CHICAGO, IL, USA",SWEATY GENERALIST,25-34,ATHLETIC,,feel,quality,2016-10-14,0,0,"{'LL_response_content': ""Hi Bodypumper87,\nYikes, we're sorry to here that unraveling threads is going on with your Align Pant. We stand behind our gear and would love to make things right for you. Keep an eye on your inbox - I've sent you an email to follow up and help."", 'LL_response_date': 'October 17, 2016'}"
"Align Pant II 25""",https://shop.lululemon.com/p/women-pants/Align-Pant-2/_/prod2020012?color=35552,2.9 out of 5,186,Liked & Disliked,"I absolutely love the feeling and style of these pants. They are easily the most comfortable Lulu's I own. However, they are the worst I own. They pill like crazy!!! I have 9 pairs and never saw a problem with them like I did with these. On top of that, I got a whole in the crotch almost immediately because the fabric wore down so fast. Kinda frustrated I wasted money on them.",2 out of 5,MBAA,,,,,,fabric,,2016-10-14,0,0,"{'LL_response_content': ""Hi MBAA,\nThanks for taking the time to reach out to us. I'm sorry to hear you are experiencing pilling with your Align Pant II, I know this is not the look you want it to have. We stand behind the quality of our gear and if our gear doesn't perform for you - we'd love to help you out. Give our GEC a call at 1.877.263.9300 and they'll help work on a resolution with you."", 'LL_response_date': 'October 17, 2016'}"
"Align Pant II 25""",https://shop.lululemon.com/p/women-pants/Align-Pant-2/_/prod2020012?color=35552,2.9 out of 5,186,Great Pants!,"I thought the Align Pant II are great! I have a black pair and love them. I hike, run, lift, and wear them going out. I have had them for about 6 months and I haven't had any issues, obviously after having then for a while they will have the normal wear and tear, like pilling, but that's with any pair of pants. I love these pants and will definitely be buying more.",4 out of 5,ALASKAHIKER7,"ANCHORAGE, AK, USA",SWEATY GENERALIST,18-24,MUSCULAR,,,,2016-10-14,2,0,{}
"Align Pant II 25""",https://shop.lululemon.com/p/women-pants/Align-Pant-2/_/prod2020012?color=35552,2.9 out of 5,186,Annoyed.,I paid so much money for these pants and the quality is abysmal. If I pay this much money for one item I expect it to last more than a month. The pants started pilling after just a few wears. They are simply not worth it.,1 out of 5,SANDVBPLAYER,"TUCSON, AZ, USA",RUNNER,18-24,ATHLETIC,,,,2016-10-14,2,0,"{'LL_response_content': ""Hello SandVbPlayer,\nThanks for reaching out. I'm sorry to hear that you've experienced pilling on your pants. Expect to receive an email shortly that will detail how to resolve this."", 'LL_response_date': 'October 15, 2016'}"
"Align Pant II 25""",https://shop.lululemon.com/p/women-pants/Align-Pant-2/_/prod2020012?color=35552,2.9 out of 5,186,All time favorite leggings,"These align pants really have changed my life, it has made me become addicted to lulu! I have two pairs of the align pant II (black and deep indigo) and they are wonderful leggings to run errands, yoga, and even workout in. I know these pants arent made for lifting weights, but they hold up even through strenuous workouts of mine. I have NOT had any problems with pilling from both pairs of leggings. I am very pleased because before buying these, so many reviews I've read were about problems with pilling but I'm glad that I tried them anyways. Cant wait to purchase more colors, and I get unlimited compliments and even my friends wanting to wear them! Highly recommend.",5 out of 5,CORRIE99,"FLORIDA, USA",SWEATY GENERALIST,UNDER 18,LEAN,,so comfortable,,2016-10-14,1,0,{}
"Align Pant II 25""",https://shop.lululemon.com/p/women-pants/Align-Pant-2/_/prod2020012?color=35552,2.9 out of 5,186,Everyday Pants,"These pants are absolutely amazing. I don't have problems that others are saying about the pants after washing them. They're in the same condition as I bought them and comfortable as ever! Wear them whenever my friends and I go out and play sports or just going out for a run and must say, it's so easy to run and stretch with these one!!! 10/10",5 out of 5,RUNNERSHIGH12,"LOS ANGELES, CA, USA",RUNNER,18-24,ATHLETIC,,,,2016-10-13,1,0,{}
"Align Pant II 25""",https://shop.lululemon.com/p/women-pants/Align-Pant-2/_/prod2020012?color=35552,2.9 out of 5,186,Pilling like crazy!,"When I tried on these pants I was blown away! The fabric was so comfortable! I didn't even want to change out of them to take them up to the register. For the first two or so months I had them they were a dream, but then my worst nightmare happened. They began to pill, everywhere! I've purchased many lulu items before so I know the drill- hand wash and lay flat to dry. But they even pilled taking this meticulous of care. For the price tag, I'd expect to get more use out of the pants than a couple months.",2 out of 5,ILOVEYOUJENNY,,YOGI,18-24,ATHLETIC,,so comfortable!,pilling pilling pilling,2016-10-13,1,0,"{'LL_response_content': ""Hey there iloveyoujenny,\nThank you for reaching out. I'm sorry to hear of the pilling that you're experiencing on your pants. This definitely shouldn't be happening, so I'd love to speak to you about how we can resolve it. Look for an email that details the next steps."", 'LL_response_date': 'October 13, 2016'}"
"Align Pant II 25""",https://shop.lululemon.com/p/women-pants/Align-Pant-2/_/prod2020012?color=35552,2.9 out of 5,186,Extremely Disappointed,"I was super excited about these pants as they're incredibly comfortable and soft. I first had the Align Pant I, but they pilled so the girls at Lulu convinced me to buy two pairs of the Align Pant II saying that the pilling issues were fixed. Although, extremely comfortable and my favorite leggings to wear... these are not worth the price at all. I have 3 year old Lulu Leggings that have held up better than these did within a month. BOTH pairs I have pilled more than I thought possible, and in the oddest places where rubbing doesn't even occur. When I brought them to my Lulu store they told me that it wasn't a ""quality issue"" and that they couldn't do anything for me. I follow all instructions and wash all of my Lulu apparel with care. In the last 6 months I have been extremely disappointed with the quality of my Lululemon Leggings. Sadly have decided to no longer purchase leggings from Lulu and to find a new brand.",1 out of 5,THEAV,,,,PETITE,,soft,pilling,2016-10-13,2,0,"{'LL_response_content': ""Hello there theav,\nI'm sorry to hear of the pilling and store interaction that you've experienced. I can completely understand why you're disappointed with this. I'd love to turn this around, so please look for an email that will allow us to chat further."", 'LL_response_date': 'October 13, 2016'}"
"Align Pant II 25""",https://shop.lululemon.com/p/women-pants/Align-Pant-2/_/prod2020012?color=35552,2.9 out of 5,186,love the pants,"My first pair of LULU pants as a gift from my sister who loves LULU. I love these pants, however after only washing them twice and then air drying them, they are pilling between my thighs and on my right hip. I still wear them because you can't tell but for pants that are so expensive, I would expect better quality. Will still buy them but would love better quality.",3 out of 5,ANJPA,"SAN FRANCISCO,",SWEATY GENERALIST,25-34,CURVY,,fit,pilling,2016-10-12,1,0,"{'LL_response_content': ""Hey there anjpa,\nThanks so much for reaching out to us. I'm sorry to hear of the pilling that you've experienced on your pants. I'd like to speak further to you about this, so expect to receive an email that details the next steps. Chat soon."", 'LL_response_date': 'October 13, 2016'}"
"Align Pant II 25""",https://shop.lululemon.com/p/women-pants/Align-Pant-2/_/prod2020012?color=35552,2.9 out of 5,186,Better than Wunder Under,"obsessed with these pants. The most comfy pants I own from lulu
can wear these everywhere
have no experienced pilling, as the other reviews indicate and I've washed my 2 pairs multiple times
will never buy another pair of wunder unders",5 out of 5,SWIFTLYLULU123,"MASSACHUSETTS, USA",SWEATY GENERALIST,18-24,ATHLETIC,,comfort,,2016-10-12,0,0,{}
"Align Pant II 25""",https://shop.lululemon.com/p/women-pants/Align-Pant-2/_/prod2020012?color=35552,2.9 out of 5,186,Not holding up,"I have always loved the Align pants and have about 4 pairs. They are super soft and great to wear around the apartment. However, my most recent pair I purchased in August did not hold up. I bought the Deep Indigo color which was super cute but after 5 times wearing them they were showing major wear. They aren't as soft and look like I have had them for 4 years. I followed all of the washing instructions and still they look old and are not soft anymore.",3 out of 5,KRIS1000,"BOSTON, MA, USA",,25-34,ATHLETIC,,,,2016-10-12,0,0,"{'LL_response_content': ""Hi there Kris1000,\nThanks for taking the time to leave your review. I'm sorry to hear of the wear that you're experiencing with your pants. I'd like to chat more with you about this, so expect to receive an email shortly. It'll explain the next steps to take."", 'LL_response_date': 'October 13, 2016'}"
"Align Pant II 25""",https://shop.lululemon.com/p/women-pants/Align-Pant-2/_/prod2020012?color=35552,2.9 out of 5,186,Was in love but it was fleeting,"When I first tried the Align 2 pants on, I instantly fell in love. They we so soft and fit perfectly. They immediately became my favorite yoga pants. That was June 20, 2016. Fast forward to October and they are a pilling mess! I am so sad. I really thought we had something special, but I cannot accept this type of behavior so soon.",1 out of 5,DIDA,"FREDERICKSBURG, VA 22401, USA",YOGI,45-54,ATHLETIC,,comfort,pilling!!!!,2016-10-12,0,0,"{'LL_response_content': 'Hi Dida,\nOh dear. Thanks for taking the time to share this feedback with us- we always want to ensure that our gear is performing for you as intended, and will be sending you an email so we can chat further.', 'LL_response_date': 'October 12, 2016'}"
"Align Pant II 25""",https://shop.lululemon.com/p/women-pants/Align-Pant-2/_/prod2020012?color=35552,2.9 out of 5,186,disappointing,"I'm a yoga teacher; and I love lulu gear and have so much of their stuff- new things and things from years ago that last and still look new! I've had these pants for about 2 months and hand wash them and hang dry and they're starting to pill -(my thighs don't rub together, so this makes no sense) I didn't even think to read the reviews! For the cost of these, I would've got another pair of more durable leggings or pants. I gave 1 star for comfort, but I'm so disappointed! :(",1 out of 5,YOGAZOEY,"STAMFORD, CT, USA",SWEATY GENERALIST,35-44,ATHLETIC,,comfort fit,pilling,2016-10-12,0,0,"{'LL_response_content': ""Hi yogazoey,\nThanks for taking the time to reach out to us! We stand behind the quality of our gear, and if our product doesn't perform for you - we'd love to help you out. I'm sorry you are experiencing pilling issues with your pants, we'd love to make this right and create a resolution for you. We have sent you an email outlining your return options."", 'LL_response_date': 'October 12, 2016'}"
"Align Pant II 25""",https://shop.lululemon.com/p/women-pants/Align-Pant-2/_/prod2020012?color=35552,2.9 out of 5,186,Piling Disaster for $98,"I purchased these in my local store after I felt how amazingly soft they were. I have quite a bit of lulu and know how to wash and care for these pieces, so I am horrified that they are already piling after 2 wears. For $98, I expect much better. I've had yoga pants from Target that I've paid a fraction of the cost for last longer. Really disappointed in the quality. My mom was with me at the time and also bought a pair that she hasn't worn yet so I've advised her to take them back since I'm assuming she'll have the same issue.",1 out of 5,AAEMA,,SWEATY GENERALIST,,,,,,2016-10-12,0,0,"{'LL_response_content': 'Hey aaema,\nOh dear. Pilling on your Align Pant II after only two wears is not the product experience we want you to be having. An email is on the way so we can follow up and work towards a solution together.\nSpeak with you soon.', 'LL_response_date': 'October 12, 2016'}"
"Align Pant II 25""",https://shop.lululemon.com/p/women-pants/Align-Pant-2/_/prod2020012?color=35552,2.9 out of 5,186,Extremely Comfortable,"These are my favorite pair of pants I own. They are very soft and so so comfortable. Would recommend them for yoga or just every day wear. I also strongly suggest you order a size down. I wear a 6 in everything but for these I am a 4-and they also have stretched out over a short period of time, which is my only compliant. So far no pilling and I only hand wash/line dry. Worth the money.",4 out of 5,YOGI1234909I,"KANSAS CITY, KS, USA",YOGI,18-24,ATHLETIC,,soft feeling,stretch out,2016-10-12,1,0,{}
"Align Pant II 25""",https://shop.lululemon.com/p/women-pants/Align-Pant-2/_/prod2020012?color=35552,2.9 out of 5,186,Extremely Comfortable but Poor Quality,I tried these pants on in the store and fell in love with them! They are so comfortable and fit very well. However after only wearing them a few times and washing once I started to notice major pilling as well as one of the seams pulling loose. I love lululemons products but I really wish they were better quality. If I am spending nearly $100 for these leggings they should be of a much higher qulity then this.,2 out of 5,DANCERSOPHIA,"LONG ISLAND, NEW YORK, USA",DANCER,18-24,MUSCULAR,,comfort,pilling,2016-10-11,0,0,"{'LL_response_content': 'Hey dancersophia,\nWe appreciate you getting in touch about your Align Pant II. We stand behind the quality of our gear and would like to work towards a solution with you. Reach out to our GEC so one of our educators can help you out: 1.877.263.9300.\nChat with you soon.', 'LL_response_date': 'October 12, 2016'}"
"Align Pant II 25""",https://shop.lululemon.com/p/women-pants/Align-Pant-2/_/prod2020012?color=35552,2.9 out of 5,186,Crazy Pilling,"When I first put these leggings on they were so soft I felt like I wasn't even wearing pants! They were great for the first two weeks. But I've had them for two months now and the pilling is CRAZY. There is so much pilling in-between the thighs on these, it looks like target leggings. I've never had this happen with any other lulus. My wunder unders have minimal pilling, nothing compared to these. :( Also, I've worn and treated these exactly the same as the wunder unders.",2 out of 5,PRII,"ST. LOUIS, MO, USA",,,CURVY,,soft,pilling,2016-10-11,1,0,"{'LL_response_content': 'Hey Prii,\nWe appreciate you taking the time to share your disappointment with the pilling on your Align Pant II. We stand behind the quality of our gear and have sent some solutions your way.\nChat with you soon.', 'LL_response_date': 'October 12, 2016'}"
"Align Pant II 25""",https://shop.lululemon.com/p/women-pants/Align-Pant-2/_/prod2020012?color=35552,2.9 out of 5,186,Wanted to Love,"I received these as a birthday present from my husband. I wanted to love them and when I first wore them, I absolutely DID! Unfortunately, 2 washes later, it is pilling and looks ugly/cheap. I cannot wear them out anymore.",2 out of 5,SFBERRY,,,,,,,,2016-10-11,0,0,"{'LL_response_content': ""Hey sfberry,\nWe hear the disappointment you're experiencing with the pilling on your Align Pant II. Reach out to our GEC at 1.877.263.9300 so one of our educators can help work towards a solution with you.\nChat with you soon."", 'LL_response_date': 'October 12, 2016'}"
"Align Pant II 25""",https://shop.lululemon.com/p/women-pants/Align-Pant-2/_/prod2020012?color=35552,2.9 out of 5,186,Just Love These,"I've had mine for about 9 months now. Really love them. So much so my poor beloved wunder unders are shouting, hey, we're still in here!!
Absolutely no issues with these for me. A great fit (5'7"", 118, size 2), zero movement zero adjusting needed, zero restrictions, complete comfort. No issues with durability or washing.
If i had not been spending so much on Lulu bottoms and tops i've needed more for bike commuting i'd have more pairs by now but i feel sure i won't be able to resist the groovy purple hue just out. I have a nice indigo from last winter. i need a black too.
I do love these and am bewildered by the unhappy reviews!",5 out of 5,SURLYRIDER,"MANHATTAN, NEW YORK, NY, USA",SWEATY GENERALIST,55-65,ATHLETIC,,softness,nothing,2016-10-11,1,0,{}
"Align Pant II 25""",https://shop.lululemon.com/p/women-pants/Align-Pant-2/_/prod2020012?color=35552,2.9 out of 5,186,Loved until they started coming apart ... after one wash,"I received a gift card for my birthday and was so excited to treat myself to my first pair of lulu leggings! I was so disappointed when they pilled and the seam threading started to come apart after one wash. I made sure to wash them on delicate cycle, cold water and hung them to dry. When I first got them I loved them, but now I can't see spending as much money on leggings that fall apart when I have spent much less on leggings that have lasted years.",3 out of 5,KRI227,,RUNNER,25-34,ATHLETIC,,fit and texture,pilling and seams,2016-10-11,0,0,"{'LL_response_content': 'Hey Kri227,\nYikes. Pilling and unraveling seams especially on a birthday gift to yourself must be frustrating. We stand behind the quality of our gear and have sent some solutions your way.\nChat with you soon.', 'LL_response_date': 'October 12, 2016'}"
"Align Pant II 25""",https://shop.lululemon.com/p/women-pants/Align-Pant-2/_/prod2020012?color=35552,2.9 out of 5,186,Obsessed but so upset!,"Let me just start this review by saying that I am absolutely obsessed with these pants. They feel incredible and handle all my crazy sweaty workouts with ease. I put them on at every opportunity to yoga, run, go out in, you-name-it. That being said--after just three wears (with washes and hanging to dry in between) the seams began coming undone. I haven't had any issues with pilling but am noticing with each wear that new seams begin to unravel. I haven't had any come completely apart yet but will be so sad if that happens!",4 out of 5,JAMIEEES,"BOULDER, CO, USA",YOGI,25-34,PETITE,,the feel,the pilling,2016-10-11,0,0,"{'LL_response_content': 'Hey jamieees,\nWe appreciate you taking the time to share your feedback on the Align Pant II. As these bad boys were designed for yoga, we recommend using them for their intended design purpose and avoid using them for high-friction, high-impact activities such as running. That said, we stand behind the quality of our gear and have sent an email your way so we can do some digging into this.\nChat with you soon.', 'LL_response_date': 'October 12, 2016'}"
"Align Pant II 25""",https://shop.lululemon.com/p/women-pants/Align-Pant-2/_/prod2020012?color=35552,2.9 out of 5,186,Loved these until they pilled,"So amazingly comfortable I bought two pairs. Unfortunately, like all the reviews state, they pilled. I went to my local lululemon and the store manager told me there was nothing she would do. This, in addition to another pair of pants that are also coming undone, makes me so upset and disappointed. It seems Lululemon no longer stands behind their products. I am a weekly customer but cannot continue to purchase clothing that falls apart.",1 out of 5,CEEJESQ,NEW JERSEY,SWEATY GENERALIST,35-44,CURVY,,fit and feel,pilling,2016-10-11,0,0,"{'LL_response_content': ""Hey Ceejesq,\nWe hear the disappointment you're experiencing with your Align Pant II and would like to do some digging into this. An email is on the way so we can follow up and help.\nChat with you soon."", 'LL_response_date': 'October 12, 2016'}"
"Align Pant II 25""",https://shop.lululemon.com/p/women-pants/Align-Pant-2/_/prod2020012?color=35552,2.9 out of 5,186,Really wanted to love them...,"These leggings are very soft, and I was so excited about them because I tried them on in-store and it doesn't show my panty-line as much as other leggings do. Unfortunately, they did not last, and I'm extremely bummed about spending so much on these leggings. If your thighs touch, which normal people's thighs do, you will see a LOT of pilling in the inner thigh area because of the friction. I also noticed that after one wash, they looked very worn and old, because they picked up dust and lint much more easily as opposed to when they were new.
I'm really upset that I invested so much in a pair of leggings I won't be wearing anymore. I only wore these a couple of times casually before seeing all of these quality flaws, so I can't imagine how horribly they'd hold up if I had worn them to yoga.",1 out of 5,MATHA,"BERKELEY, CA, USA",YOGI,18-24,LEAN,,,,2016-10-11,0,0,"{'LL_response_content': ""Hey Matha,\nWe appreciate you taking the time to share your feedback around the pilling you're experiencing with your Align Pant II. We stand behind the quality of our gear and would like to get the ball rolling on a solution for you. An email is on the way.\nChat with you soon."", 'LL_response_date': 'October 12, 2016'}"
