"Align Pant II 25""",https://shop.lululemon.com/p/women-pants/Align-Pant-2/_/prod2020012?color=35552,2.9 out of 5,191,Disappointed,"When I tried these pants on in the store I fell in love! They are so soft and so light weight that I absolutely had to buy them. Ive only worn them around the house so far and somehow an entire chunk of the back of the pants have crazy pilling. I never even wore these to the gym so I'm not sure what I could've rubbed up against IN MY HOUSE to cause so much pilling. Ive bought dozens of items from lulu but lately all the pants have seem to have this problem with pilling even though I follow the wash instructions exactly. Bottom line love the material, but very disappointed with the quality for the price.",2 out of 5,GSUTH,,SWEATY GENERALIST,18-24,ATHLETIC,,fabric,pilling,2016-08-14,5,0,"{'LL_response_content': ""Hi gsuth,\nWe're sorry to hear you're experiencing pilling with your Align Pant II. We would love to ask you a few questions to better understand why you may be experiencing this. We have sent you an email to have a further chat."", 'LL_response_date': 'August 16, 2016'}"
"Align Pant II 25""",https://shop.lululemon.com/p/women-pants/Align-Pant-2/_/prod2020012?color=35552,2.9 out of 5,191,THESE ARE A NO-GO,"Bought these with high hopes, but they are a disappointment. I wore them twice, hand washed, and air dried them. The stitching on them is completely coming undone and they are already pilling on parts that don't even rub together. Treated myself to some lulus and did not get my money's worth whatsoever. Really loved these at first, though. If only the quality would stay intact. .",3 out of 5,LULULOVER1324,,,,,,very comfortable,pilling,2016-08-14,3,0,"{'LL_response_content': ""Hi lululover1324,\nWe're sorry to hear the stitching is unraveling on your Align Pant II and that you're experiencing pilling. We stand behind the quality of our product, and we want to ensure that you're in gear that is performing well for you. Please give our GEC a call- 1.877.263.9300 as they'll be able make some recommendations about how to proceed."", 'LL_response_date': 'August 16, 2016'}"
"Align Pant II 25""",https://shop.lululemon.com/p/women-pants/Align-Pant-2/_/prod2020012?color=35552,2.9 out of 5,191,Want to love,"I really wanted to love these pants. They are so soft, comfortable and supportive in all the right places without being see-through. However, after about 3 months of light wear and hand washing as prescribed, the top of the thighs have become increasingly pily.",3 out of 5,ALLIDEFRAN,,,25-34,ATHLETIC,,,,2016-08-12,4,0,"{'LL_response_content': ""Hey allidefran,\nOh dear. We're sorry to hear you're experiencing pilling and coverage issues after three months of wear. An email is headed your way so we can work towards a solution together.\nSpeak soon."", 'LL_response_date': 'August 15, 2016'}"
"Align Pant II 25""",https://shop.lululemon.com/p/women-pants/Align-Pant-2/_/prod2020012?color=35552,2.9 out of 5,191,"LOVED the align pants, initially....","I absolutely LOVED the align pants, initially. I tried a pair on at the store and immediately fell in love, so much so that I came home and ordered 3 other align pants online. I loved the way they feel and especially the super flattering look. Ive had my align pants for less than ONE year, and even with extremely careful laundering and wear, the piling is insane, and look as if they are 10+ years old . . I have multiple items from lulu that are 5-6+ years old that look much better. I am dissapointed to invest so much money, to have to be extremely careful with the fragile pants but still have them fall apart so quickly :(",2 out of 5,CHANSOKHA,"TACOMA, WA, USA",YOGI,25-34,ATHLETIC,,,,2016-08-12,4,0,"{'LL_response_content': 'Hey chansokha,\nYikes. We definitely hear your disappointment with the pilling your Align Pant II are experiencing especially after taking such good care of them. Keep an eye out for an email headed your way so we can work towards a fix together.\nSpeak soon.', 'LL_response_date': 'August 15, 2016'}"
"Align Pant II 25""",https://shop.lululemon.com/p/women-pants/Align-Pant-2/_/prod2020012?color=35552,2.9 out of 5,191,I'll never want to wear anything else,"I bought the align pants because one of my girlfriends who uses/wears Lulu for similar activities as I do highly recommended them. I decided to bite the bullet on the full price and bought my first pair as a crop and I was instantly in love. Within 3 weeks, I bought 2 more pairs in the align 7/8 pant. I just bought my 3rd 7/8 align pant in the new navy color and I know I will continue to add on the colors and they come out with new ones. Yes, I went crazy for these pants. Let me tell you why. These pants are soft with that naked sensation that they talk about, it is really true. The high waist does not fold when you are working out, it stays put. These pants are not see-through (which I cannot say for some other Lulu pants on me). They are true to size. You can do almost any athletic exercise in them. They look so good on! They really tighten everything without making you feel like it, so you legs and backside look good.. I honestly LOVE the way they make my backside look more than any other legging. And warning: you will want to wear these every day even when you are not exercising. I went on a vacation that involved a lot of walking/hiking and wore these - even in the heat they feel light and comfortable. I also like wearing them for daily errands. Basically, I blame these pants for making me not want to wear anything else- they are worth it! Try them and you will not be disappointed.",5 out of 5,SIMAY,"FAIRFAX, VA, USA",SWEATY GENERALIST,18-24,ATHLETIC,,,,2016-08-10,5,0,{}
"Align Pant II 25""",https://shop.lululemon.com/p/women-pants/Align-Pant-2/_/prod2020012?color=35552,2.9 out of 5,191,Dissapointed,"When I first introduced to Lulus, WOW I fell in love with everything about them. I've had my align pants in black for about 3 months. I always wash my lulus separate from all my regular clothing, but recently I have been noticing that the stitching on some parts are coming loose and the piling is just getting worse. I really hope this doesn't happen to my other 2 pairs for the price I paid for each.",3 out of 5,KAYLAESPIE,"TEXAS, USA",SWEATY GENERALIST,25-34,ATHLETIC,,feel comfort mobility appearance,piling loose ends,2016-08-10,1,0,"{'LL_response_content': ""Hello there KaylaEspie,\nI'm sorry to hear of the loose stitching and pilling that you're experiencing on your pants. I can understand why you're disappointed by this and I'd love to turn this all around. Look for an email that will detail the next steps to take."", 'LL_response_date': 'August 11, 2016'}"
"Align Pant II 25""",https://shop.lululemon.com/p/women-pants/Align-Pant-2/_/prod2020012?color=35552,2.9 out of 5,191,Deep Indigo--- not so much,"The Deep Indigo pant color was nothing like the photo, was a lot more washed out looking and no where near a deep color... I do love the align pants, so I shall be keeping them, the color is not bad, just definitely not what I expected from the photos..",4 out of 5,MEMPHISNATIVE,"MEMPHIS, TN, USA",YOGI,25-34,ATHLETIC,,,,2016-08-10,1,0,{}
"Align Pant II 25""",https://shop.lululemon.com/p/women-pants/Align-Pant-2/_/prod2020012?color=35552,2.9 out of 5,191,Amazing fit,"I bought these pants for teaching my classes , they are my all time favourite . They fit really well and they feel amazing on .",5 out of 5,LOUGHY,IRELAND BUT LIVE IN SCOTLAND IN THE UK,SWEATY GENERALIST,35-44,SOLID,,the material and length,,2016-08-09,0,0,{}
"Align Pant II 25""",https://shop.lululemon.com/p/women-pants/Align-Pant-2/_/prod2020012?color=35552,2.9 out of 5,191,Excellent pants,"I rarely leave reviews, but given the abundance of negative reviews about these pants, I wanted to give my experience. I own several pairs of Align pants: Align II in black, and Align I in black, deep zinfandel and hero blue., and I wear them all regularly. When I first bought the pants, I was nervous about how they would hold up due to all the negative reviews about pilling and such, but my pants have held up great. I wash them constantly, and I have not experienced any of the major issues others are citing - the only pilling I have experienced is from my nails snagging the pants - other than that, the pants are pill-free. I wash my Align pants constantly, and they look the same as when I purchased them over five months ago. I wash all my Lulu items in delicates bags on hand wash cycle in cold water, and I NEVER put them anywhere near a dryer. The only warning I will give is that the non-black colors tend to show sweat very easily, but they dry quickly.",5 out of 5,CAITLIN34,,,,,,,,2016-08-09,2,0,{}
"Align Pant II 25""",https://shop.lululemon.com/p/women-pants/Align-Pant-2/_/prod2020012?color=35552,2.9 out of 5,191,Paid for pilling,"I'm petite, and I'm muscular. I weight lift 5-6x a week, and I found the weightlessness of these align pants to be wonderful. During deadlifts and squats, I did not feel any bunching at the knees, I didn't feel any rolling or cutting of the waistband, and I felt covered and comfortable.
The pros end there. Although weightlifting doesn't cause you to sweat profusely like HIIT, I still sweat from supersets and heavy weight, and these leggings hide no sweat. The crotch area is particularly vivid in sweat marks.
Furthermeo, I'm small, and I do have a thigh gap. However, even though my legs don't rub when I walk or run, my inner thighs still pilled. The rear of the leggings pilled, and the quad area and crotch area has pilling as well. I paid for pilling by the looks of these pants... :(
I'm extremely disappointed in this legging. The price is not worth the mishaps in fabric quality. It has so much potential, but after 3 pairs of align pants.... I'm wondering if Lululemon even pays attention to our reviews at this point.",2 out of 5,MGAVIOLA,,,18-24,MUSCULAR,,buttery feel,pilling,2016-08-08,7,0,"{'LL_response_content': ""Hi mgaviola,\nI appreciate you taking the time to let us know this happened to your pant. We stand behind the quality of our gear, and if our product doesn't perform for you, we’d love to help you out. While pilling does not impact the functionality of your pants, I know it is not the look you want them to have. We'd love to make this right, and create a resolution for you. We have sent you an email to chat with you further."", 'LL_response_date': 'August 8, 2016'}"
"Align Pant II 25""",https://shop.lululemon.com/p/women-pants/Align-Pant-2/_/prod2020012?color=35552,2.9 out of 5,191,Comfort over quality,I recently received these pants as a gift and instantly fell in love! They are seriously the most comfortable pants I own from lulu and I wanted to immediately go back and purchase the navy blue. However after 2 wears they started pilling. I was devasted because the fabric feels amazing. Please fix!!,2 out of 5,CJC27,NJ,SWEATY GENERALIST,25-34,ATHLETIC,,comfort,pilling,2016-08-07,2,0,"{'LL_response_content': ""Hi Cjc27,\nThank you for taking the time to share your experience with the Align Pant with us. We would love to chat with you further to gather more information about what you're experiencing, we will be reaching out to you via email."", 'LL_response_date': 'August 7, 2016'}"
"Align Pant II 25""",https://shop.lululemon.com/p/women-pants/Align-Pant-2/_/prod2020012?color=35552,2.9 out of 5,191,Comfort!,"I am very picky with leggings. Seams and different materials bother me. These are straight from Heaven! They are extremely soft and stretchy. For reference, I am usually a 6 or 8 (5'7"", 130 and curvy). I have both sizes, but prefer the 6. If debating on sizes, choose the smaller size as they easily stretch to fit your body. I have washed them several times (washer and drier), and so far...no problems. I can tell which ones I have worn more.....so I might have to buy more soon. VERY PLEASED!",5 out of 5,MCDL1234,IOWA,,35-44,CURVY,,the softness,,2016-08-06,3,0,{}
"Align Pant II 25""",https://shop.lululemon.com/p/women-pants/Align-Pant-2/_/prod2020012?color=35552,2.9 out of 5,191,Disappointed,"I wanted to love these so badly, and I really do. They're truly buttery soft, lightweight, and opaque. I am able to do my barre classes in these and they never smell afterwords. The only problem is the pilling! I am extremely careful with these and take care to only wash them in cold (inside out) and air dry. And without fail, they have pilled. I love these pants and wish they wouldn't pill! My mat after class is COVERED in black fabric from my pants. I could deal with this problem if the pants were $20, but at $98 it's not worth it.",1 out of 5,CHLOESB10,"SANTA ROSA BEACH, FL 32459, USA",YOGI,18-24,PETITE,,,,2016-08-06,1,0,"{'LL_response_content': ""Hi Chloesb10,\nI appreciate you taking the time to let us know this happened to your crop. We stand behind the quality of our gear, and if our product doesn't perform for you, we’d love to help you out. While pilling does not impact the functionality of your pants, I know it is not the look you want them to have. We'd love to make this right, and create a resolution for you. We have sent you an email to chat with you further."", 'LL_response_date': 'August 7, 2016'}"
"Align Pant II 25""",https://shop.lululemon.com/p/women-pants/Align-Pant-2/_/prod2020012?color=35552,2.9 out of 5,191,super soft awful wear !,"This is the second time I have purchased these pants. The comfort is great but they seem to pill just awful in the legs for the amount of money being spent. I have only had them for two two weeks and am super carful in the way I wash them. Always inside out with nothing else and air dry .. to top it off, I just wear them out and about not to even work out in. Getting frustrated and can't keep spending $$ on these. Lulu what is a similar pant that will have better wear than these ??",1 out of 5,LULUMOMMA16,NY,YOGI,25-34,PETITE,,comfort,bad pilling,2016-08-04,3,0,"{'LL_response_content': ""Hey lulumomma16,\nOh no, we're sorry to hear you're experiencing pilling with your Align Pant II. I hear your disappointment and an email is on its way to you so we can follow up and chat further.\nSpeak soon."", 'LL_response_date': 'August 4, 2016'}"
"Align Pant II 25""",https://shop.lululemon.com/p/women-pants/Align-Pant-2/_/prod2020012?color=35552,2.9 out of 5,191,Most comfortable pants ever,"These are the most comfortable bottoms I've ever put on. I love the fit, feel, and rise of these. Unlike other reviewers, I haven't had a problem with pilling. I've worn/washed mine about 5 times now- I always wash inside out on cold and then hang to dry. They are still like new to me (I got the black). I just ordered the blue in hopes for the same great quality! I don't wear these to run or do a lot of cardio in, but I LOVE them for weight lifting and for yoga. And of course- to lounge around in!",5 out of 5,AH85,ARIZONA,SWEATY GENERALIST,25-34,ATHLETIC,,comfort,,2016-08-03,2,0,{}
"Align Pant II 25""",https://shop.lululemon.com/p/women-pants/Align-Pant-2/_/prod2020012?color=35552,2.9 out of 5,191,Disappointed :(,"I was so excited to give these pants a try. Being new to lulu, my friend who works at the store suggested these because of how comfortable they are. I was already apprehensive to spend $100 on a pair of yoga pants, but after just feeling them I convinced myself. I was seriously SO excited, I treated them like gold and was very cautious during every wash (washed inside out, totally separate from everything else, let air dry) Even after following those orders, they started pilling after wearing them maybe 4 times... very disappointing.",1 out of 5,BFIT1324,"NAPLES, FL, USA",,25-34,,,soft fabric,pilling,2016-08-03,1,0,"{'LL_response_content': ""Hey BFit1324,\nThese bad boys are so buttery-soft and feel like a warm hug from a close friend. We're sorry to hear you've experienced pilling and have sent an email your way with some solutions.\nSpeak soon."", 'LL_response_date': 'August 4, 2016'}"
"Align Pant II 25""",https://shop.lululemon.com/p/women-pants/Align-Pant-2/_/prod2020012?color=35552,2.9 out of 5,191,pilling and hole on both inner thigh area,LOVE the way they feel this was my second pair but both pairs shortly after wearing them started to pile up so bad and the inner seam came apart and there is now holes. Wish the quality was a bit better especially for the price.,1 out of 5,MEENS,"TROY, MI, USA",,35-44,CURVY,,,,2016-08-03,1,0,"{'LL_response_content': 'Hi meens,\nOh dear. Thanks for taking the time to share this feedback with us- we always want to ensure that our gear is performing for you as intended, and will be sending you an email so we can chat further.', 'LL_response_date': 'August 3, 2016'}"
"Align Pant II 25""",https://shop.lululemon.com/p/women-pants/Align-Pant-2/_/prod2020012?color=35552,2.9 out of 5,191,So comfortable. So much pilling,These pants are absolutely amazing after trying them on in the store and hearing the employee rave about them i caved and bought them. after only two wears (going to and from yoga both times) and one wash they are already pilling like crazy. so incredibly comfortable but for $98 save your money and buy a fabric that won't pill,2 out of 5,THEFASTERTHEBETTER,"SAN DIEGO, CA, USA",SWEATY GENERALIST,18-24,ATHLETIC,,comfort,pilling,2016-08-02,2,0,"{'LL_response_content': ""Hi thefasterthebetter,\nThanks for taking the time to reach out and share your experience with the Align Pant. We'd love to help you out and gather more information from you, keep an eye on your email since we'll be reaching out."", 'LL_response_date': 'August 3, 2016'}"
"Align Pant II 25""",https://shop.lululemon.com/p/women-pants/Align-Pant-2/_/prod2020012?color=35552,2.9 out of 5,190,So in comfy and so easy to love!,"Out shopping with my Sister in law (who Is responsible for my addiction to this store) we came across these and absolutely fell in love with the texture and feel of the fabric. The fit and how they feel are outstanding! I primarily love my Studio Pant crops and pant collection. But these are easily just as loveable if not more. I pray mine won't pill like many have stated. I have washed them a few times already and so far so good. Just wish there were more colors and possibly some prints. The olive green I have I love, and hope to ad more to my collection.",5 out of 5,SWEET725,"PORT ORCHARD, WA, USA",SWEATY GENERALIST,35-44,CURVY,,super comfy,lack of colors available,2016-09-07,0,0,{}
"Align Pant II 25""",https://shop.lululemon.com/p/women-pants/Align-Pant-2/_/prod2020012?color=35552,2.9 out of 5,190,Pilling in crotch after 3 wears,"I loved the way these pants felt the moment I tried them on. I got home and wore them a few more times. I loved them so much I bought a pair in black and blue knowing they would be a staple in replacing some old high times, and wunder capris. So disappointed I can not even tell the difference between the newer and older. In a matter of 2 months both black pairs have SIGNIFICANT pilling in the crotch. More than any other lulu pants I've owned. I am so sad to spend a couple hundred dollars on pants that are now almost trashed. I know how to wash and wear my lulu. Have been a fan and owner of lulu for many years now. Never washed in hot, always hung dry, no softener. These have not held up to the bargain whatsoever.",1 out of 5,SANDIANNIE,"BELLINGHAM, WA, USA",YOGI,35-44,CURVY,,buttery soft feel,quickly worn out,2016-09-06,0,0,"{'LL_response_content': ""Hey Sandiannie,\nThanks for checking in. Yikes, pilling is definitely not what we like to hear. We stand behind our gear and would love to make things right for you, so check your inbox - we've sent you an email to follow up and help."", 'LL_response_date': 'September 7, 2016'}"
"Align Pant II 25""",https://shop.lululemon.com/p/women-pants/Align-Pant-2/_/prod2020012?color=35552,2.9 out of 5,190,Great fit...but,"Great idea, they are designed to maximize comfort, but they aren’t best quality. They fit and look great, softest leggings I ever had, but after one single wash they look old and cheap. They are perfect “home” yoga pants, not to be worn on public.
Huge disappointments. Hopefully next creating is going to be better.",2 out of 5,BUFFHUNNYBUNNY,"BELLEVUE, WA, USA",SWEATY GENERALIST,25-34,ATHLETIC,,fit great,poor quality,2016-09-06,0,0,"{'LL_response_content': ""Hey BuffHunnyBunny,\nThanks for taking the time to share this feedback with us. We stand behind the quality of our gear, and want to make sure it's performing for you. I understand that this isn't the case, and would like to work with you to find a resolution.  I’ve sent you an email to follow up. Chat with you soon. "", 'LL_response_date': 'September 7, 2016'}"
"Align Pant II 25""",https://shop.lululemon.com/p/women-pants/Align-Pant-2/_/prod2020012?color=35552,2.9 out of 5,190,"Gorgeous Fit, Poor Quality","I purchased these lightweight pants as per a recommendation of an employee at the South Coast Plaza store. I tried them on of course and instantly fell in love with how they hugged my curves. I was also very taken by their softness. As an avid Lululemon shopper, I look no where else for yoga pants and comfortable attire, however, these pants were a HUGE disappointment to say the least. I have only worn them TWICE and they already look so old. The fabric has started piling on the sides and I don't think I'll ever be wearing these again. It's such a shame, that these pants turned out to be disposable.",1 out of 5,ECRTZ,"IRVINE, CA, USA",YOGI,25-34,ATHLETIC,,fit,horrible & poor quality,2016-09-06,1,0,"{'LL_response_content': ""Hi ecrtz,\nYikes, we're sorry to hear of the pilling you're experiencing. We stand behind our gear and would love find a fix, so keep an eye out for an email bound to hit your inbox soon."", 'LL_response_date': 'September 6, 2016'}"
"Align Pant II 25""",https://shop.lululemon.com/p/women-pants/Align-Pant-2/_/prod2020012?color=35552,2.9 out of 5,190,I love them but...,"These pants fit great and they are literally the softest things I've ever had on my body. This material feels like butter. I was so excited to have a quality pair of leggings for yoga and working out, but after the first wash they started to pill badly. I've washed them once, per the instructions on the website, and it's totally lessened the quality of the pants. I'm scared to wash them again! I was so so disappointed because for the amount of money paid, I thought I was getting a quality, long-lasting product.",3 out of 5,MICHIGANYOGI,,YOGI,18-24,LEAN,,super soft material,pilling,2016-09-06,1,0,"{'LL_response_content': ""Hi michiganyogi,\nThanks for taking the time to connect with us. Oh dear! I'm sorry to hear you're experiencing pilling with your Align Pant II, and I definitely get your frustration. I've sent you an email so we can follow up on this issue and make things right - chat soon!"", 'LL_response_date': 'September 6, 2016'}"
"Align Pant II 25""",https://shop.lululemon.com/p/women-pants/Align-Pant-2/_/prod2020012?color=35552,2.9 out of 5,190,Love.. but tragic end,"I've been a lulu addict for years now. When I first saw the align pant come out, I assumed it'd be similar to the High Times pant, which I already owned, and didn't see a true need for them. WRONG. I bought these pants about two weeks ago and I already am obsessed. I love the cut and how the crotch seaming is carried long down the inner leg so they are so comfy and move with me during practice or light workouts! Now lets talk about the fabric- love the buttery feel, and that they still hold me in but I literally feel naked. Best. Feeing. Ever. They're awesome.
Unfortunately, my dog got into my laundry and I suppose he thought they were great too, and ate them! Legit cried- so tomorrow I am going to buy myself the same pair again because I officially can't complete my lulu collection without them!!
I recommend them to everyone! They're slowly becoming my favorite style!! Love this pant! So much so I am rebuying after just purchasing them (dogs are funny aren't they?)",4 out of 5,LULUMAKESMEFEELLIKEANINJA,UNITED STATES,SWEATY GENERALIST,18-24,LEAN,,cut,,2016-09-06,2,0,{}
"Align Pant II 25""",https://shop.lululemon.com/p/women-pants/Align-Pant-2/_/prod2020012?color=35552,2.9 out of 5,190,Awesome pants... for two wears :(,"I absolutely loved these pants. They feel amazing, look amazing, and were absolutely my top favorite lulu purchase. Unfortunately on my third time wearing them I noticed that the seam started to unravel on the leg. Washed them in cold water and never dried them. Super bummed!!",2 out of 5,K8EI,"MIDLAND, MI, USA",SWEATY GENERALIST,18-24,ATHLETIC,,,,2016-09-05,0,0,"{'LL_response_content': ""Hi k8eI,\nThanks for taking the time to share this feedback with us. We stand behind the quality of our gear, and want to make sure it's performing for you. I understand that this isn't the case, and would like to work with you to find a resolution. I’ve sent you an email to follow up. Chat with you soon."", 'LL_response_date': 'September 6, 2016'}"
"Align Pant II 25""",https://shop.lululemon.com/p/women-pants/Align-Pant-2/_/prod2020012?color=35552,2.9 out of 5,190,So Soft.... but SO. MUCH. DUST.,"When I first tried these pants on, I immediately felt like I had died and gone to heaven. I LOVE how soft these pants are! My only issue is the amount of dust etc. they attract... after about two hours of doing almost anything they have attracted all of the dust and dirt in a room, making them quite itchy. Ordinarily, this wouldn't bother me, but I've heard about a lot of pilling & so would rather not wash them after every single wear (unless working out in them). Definitely one of my favorite Lulu purchases of all time!!",4 out of 5,WORLDSOKAYESTRUNNER,"IMPERIAL BEACH, CA, USA",SWEATY GENERALIST,18-24,PETITE,,literal heaven in the form of pants,dust magnet,2016-09-05,0,0,{}
